Input Prompt,Response,Category,Context
"""What should I do if I feel overwhelmed with parenting?""","""Reach out for support, take breaks, and prioritize self-care to recharge.""",Parenting Stress,Coping with parenting challenges.
"""How can I improve my listening skills in conversations?""","""Practice active listening by maintaining eye contact and reflecting back what you hear.""",Communication Skills,Enhancing interpersonal communication.
"""What techniques can help with insomnia?""","""Establish a consistent sleep routine and limit caffeine intake before bedtime.""",Sleep Health,Addressing insomnia effectively.
"""How can I cope with feelings of inadequacy?""","""Challenge negative self-talk and focus on your strengths and achievements.""",Self-Esteem,Building self-confidence and self-worth.
"""What should I do if I feel unmotivated to engage socially?""","""Start with small interactions and gradually expose yourself to more social situations.""",Social Engagement,Overcoming social withdrawal.
"""How can I create a positive work environment?""","""Foster open communication, recognize accomplishments, and encourage teamwork.""",Workplace Wellness,Enhancing positivity in the workplace.
"""What are some practical tips for managing anxiety?""","""Practice deep breathing, engage in physical activity, and develop a relaxation routine.""",Anxiety Management,Coping strategies for anxiety relief.
"""How can I encourage open communication in my relationships?""","""Create a safe space for discussions and actively listen to your partner’s concerns.""",Communication Skills,Improving relational communication.
"""What should I do if I feel pressured to meet societal expectations?""","""Reflect on your own values and set boundaries to prioritize your well-being.""",Social Pressure,Navigating societal expectations.
"""How can I improve my resilience to life’s challenges?""","""Focus on building strong relationships and developing problem-solving skills.""",Resilience,Cultivating resilience in everyday life.
"""What are the benefits of practicing yoga for mental health?""","""Yoga can reduce stress, improve mood, and enhance overall well-being.""",Physical Health,Exploring yoga's impact on mental health.
"""How can I create a balanced schedule for my well-being?""","""Include time for work, relaxation, hobbies, and socializing to maintain balance.""",Life Balance,Managing time for holistic well-being.
"""What are the main barriers to mental health care worldwide?""","""Stigma, lack of funding, insufficient resources, and inadequate training for providers.""",Access to Care,Identifying global barriers to mental health.
"""How does stigma affect mental health treatment in different cultures?""","""Stigma can lead to shame and reluctance to seek help, varying significantly by culture.""",Stigma Awareness,Exploring cultural differences in stigma.
"""What impact does socioeconomic status have on mental health?""","""Lower socioeconomic status often correlates with higher stress levels and reduced access to care.""",Economic Factors,Understanding economic influences on mental health.
"""How can we improve access to mental health services in rural areas?""","""Increase telehealth options, train local providers, and enhance community awareness.""",Rural Mental Health,Addressing rural mental health access issues.
"""What are the effects of workplace stress on mental health?""","""Workplace stress can lead to burnout, anxiety, and depression among employees.""",Occupational Health,Examining workplace mental health challenges.
"""How does the COVID-19 pandemic impact adult mental health globally?""","""Increased isolation, anxiety, and uncertainty have led to a rise in mental health issues.""",Pandemic Effects,Assessing the global impact of COVID-19.
"""What role does social media play in mental health issues?""","""Social media can exacerbate anxiety and depression but also offer support and community.""",Social Media,Evaluating the dual effects of social media.
"""How do cultural beliefs influence mental health treatment?""","""Cultural beliefs can affect perceptions of mental illness and influence treatment choices.""",Cultural Factors,Understanding cultural impacts on treatment.
"""What is the relationship between mental health and physical health?""","""Poor mental health can lead to chronic illnesses, and vice versa.""",Holistic Health,Exploring the mind-body connection.
"""How does gender affect mental health outcomes?""","""Gender roles can influence the prevalence and expression of mental health issues.""",Gender Issues,Analyzing gender-related mental health factors.
"""What strategies can reduce stigma around mental health?""","""Education, advocacy, and personal stories can help combat stigma.""",Anti-Stigma,Promoting mental health awareness and acceptance.
"""How can communities support individuals with mental health issues?""","""Create inclusive environments, provide resources, and encourage open conversations.""",Community Support,Building supportive community networks.
"""What are the effects of displacement and refugees on mental health?""","""Displacement can lead to trauma, anxiety, and depression due to loss of community and stability.""",Refugee Mental Health,Addressing mental health in displaced populations.
"""How can workplaces promote mental well-being?""","""Implement flexible work schedules, provide mental health resources, and encourage breaks.""",Workplace Wellness,Enhancing mental health in the workplace.
"""What are the global trends in mental health care funding?""","""Funding is often inadequate, with a growing recognition of the need for increased investment.""",Mental Health Funding,Analyzing funding trends in mental health care.
"""How does access to education impact mental health?""","""Education can improve mental health literacy and access to resources.""",Education,Linking education and mental health awareness.
"""What role do families play in supporting mental health?""","""Families can provide emotional support but may also contribute to stress and dysfunction.""",Family Dynamics,Exploring family influences on mental health.
"""How does chronic illness affect mental health in adults?""","""Chronic illness can lead to feelings of helplessness and increased risk of depression.""",Chronic Illness,Understanding the interplay between physical and mental health.
"""What are effective treatments for depression on a global scale?""","""Cognitive-behavioral therapy and medication are commonly used; access varies by region.""",Treatment Options,Assessing global treatment methods for depression.
"""How does isolation impact mental health in aging populations?""","""Social isolation can lead to increased rates of depression and cognitive decline.""",Aging and Isolation,Exploring the mental health of older adults.
"""What strategies can be employed to support mental health in schools?""","""Implement mental health education, provide counseling services, and foster supportive environments.""",Educational Support,Enhancing mental health resources in schools.
"""How can teletherapy improve access to mental health care?""","""Teletherapy can reduce barriers such as distance and stigma, making care more accessible.""",Telehealth,Evaluating the effectiveness of remote therapy.
"""What are common misconceptions about mental illness?""","""Many believe that mental illness is a sign of weakness or that it can be easily overcome.""",Mental Health Literacy,Debunking myths surrounding mental health.
"""How does cultural trauma affect mental health in communities?""","""Cultural trauma can lead to collective grief and increased rates of mental health issues.""",Cultural Trauma,Understanding the impact of historical trauma.
"""What are the mental health implications of substance abuse?""","""Substance abuse often co-occurs with mental health disorders, complicating treatment.""",Dual Diagnosis,Exploring the relationship between substance use and mental health.
"""How can governments improve mental health policies?""","""By prioritizing mental health in public health agendas and increasing funding and resources.""",Policy Development,Advocating for effective mental health policies.
"""What impact does community violence have on mental health?""","""Exposure to violence can lead to PTSD, anxiety, and depression in affected individuals.""",Community Violence,Assessing the mental health effects of violence.
"""How can mindfulness practices benefit adult mental health?""","""Mindfulness can reduce stress, improve emotional regulation, and enhance overall well-being.""",Mindfulness,Promoting mindfulness as a mental health tool.
"""What is the role of advocacy in mental health awareness?""","""Advocacy can help reduce stigma, improve access to care, and influence policy changes.""",Advocacy,Supporting mental health through advocacy efforts.
"""How does the portrayal of mental illness in media affect perceptions?""","""Media can shape public perceptions, often reinforcing stigma or providing awareness.""",Media Representation,Evaluating media's impact on mental health awareness.
"""What challenges do mental health professionals face globally?""","""Low pay, high caseloads, and lack of resources can hinder effective care.""",Professional Challenges,Addressing issues faced by mental health workers.
"""How can cultural competence improve mental health care?""","""Culturally competent care can enhance trust and treatment outcomes for diverse populations.""",Cultural Competence,Enhancing care through cultural understanding.
"""What are the signs of mental health deterioration in adults?""","""Changes in behavior, withdrawal from activities, and difficulty functioning are key signs.""",Warning Signs,Recognizing early signs of mental health issues.
"""How can technology be leveraged to improve mental health support?""","""Apps, online resources, and virtual support groups can provide accessible mental health tools.""",Technology in Care,Exploring technology's role in mental health support.
"""What are the mental health challenges faced by veterans?""","""Veterans may struggle with PTSD, depression, and reintegration into civilian life.""",Veteran Mental Health,Addressing mental health issues in veterans.
"""How does language access affect mental health care?""","""Language barriers can prevent individuals from seeking help or understanding treatment.""",Language Access,Ensuring language accessibility in mental health services.
"""What role do peer support groups play in mental health recovery?""","""Peer support can provide empathy, understanding, and shared experiences for individuals.""",Peer Support,Exploring the benefits of peer support in recovery.
"""How can mental health education be integrated into public health?""","""Education can raise awareness, reduce stigma, and promote early intervention.""",Public Health,Advocating for mental health education in public health initiatives.
"""What are the long-term effects of untreated mental illness?""","""Untreated mental illness can lead to chronic health problems, relationship issues, and reduced quality of life.""",Long-Term Consequences,Understanding the implications of untreated mental health issues.
"""How can mindfulness-based interventions be implemented in schools?""","""Incorporate mindfulness practices into the curriculum and provide training for teachers.""",Educational Strategies,Promoting mindfulness in educational settings.
"""What is the impact of economic downturns on mental health?""","""Economic hardship can increase stress, anxiety, and rates of mental health disorders.""",Economic Impact,Assessing mental health during economic crises.
"""How can art therapy benefit adult mental health?""","""Art therapy provides an outlet for expression and can help process emotions and trauma.""",Creative Therapies,Utilizing creative methods for mental health.
"""What strategies can help reduce anxiety in high-pressure environments?""","""Develop coping mechanisms, encourage breaks, and foster a supportive culture.""",Anxiety Management,Addressing anxiety in stressful settings.
"""How do cultural differences shape perceptions of mental illness?""","""Cultural norms influence how mental illness is viewed and treated across different societies.""",Cultural Perspectives,Examining cultural influences on mental health perceptions.
"""What resources are available for mental health support during crises?""","""Hotlines, community centers, and online resources can provide immediate support.""",Crisis Resources,Identifying crisis support options.
"""How does trauma-informed care improve mental health treatment?""","""Trauma-informed care acknowledges past trauma and focuses on safety and empowerment.""",Trauma-Informed Care,Enhancing treatment through trauma awareness.
"""What are the signs that someone may be struggling with their mental health?""","""Look for changes in mood, behavior, and social interactions.""",Awareness,Recognizing mental health struggles in others.
"""How can we create a more inclusive environment for mental health discussions?""","""Encourage open dialogue, provide resources, and promote understanding among diverse groups.""",Inclusivity,Fostering inclusive conversations around mental health.
"""What are the signs that I might need to talk to someone about my mental health?""","""Signs can include persistent sadness, withdrawal from social activities, or changes in appetite.""",Self-Assessment,Identifying when to seek help.
"""How can I manage my anxiety when it feels overwhelming?""","""Practice deep breathing, mindfulness, and consider talking to a professional for support.""",Anxiety Management,Coping strategies for anxiety.
"""What steps should I take if I feel depressed but don’t want to see a therapist?""","""Try reaching out to supportive friends, engaging in activities you enjoy, and practicing self-care.""",Self-Help,Exploring alternatives to therapy.
"""Are there any online resources for mental health support I can trust?""","""Yes, websites like NAMI, MentalHealth.gov, and Crisis Text Line offer reliable information and support.""",Online Resources,Finding trustworthy mental health resources.
"""How can I talk to my family about my mental health struggles?""","""Be honest and open, express your feelings, and explain how they can support you.""",Communication Skills,Discussing mental health with family.
"""What should I do if I feel like my work is affecting my mental health?""","""Consider discussing your concerns with a supervisor, and explore stress management techniques.""",Workplace Wellness,Addressing work-related mental health issues.
"""How can I cope with feelings of loneliness as an adult?""","""Join community groups, volunteer, or engage in hobbies to meet new people.""",Loneliness,Tackling adult loneliness.
"""What are some effective ways to reduce stress at work?""","""Take regular breaks, practice time management, and communicate openly with your team.""",Stress Management,Strategies for reducing workplace stress.
"""How do I know if my feelings are normal or if I need help?""","""If your feelings persist and interfere with daily life, it might be time to seek support.""",Self-Assessment,Recognizing when to seek help.
"""What should I look for in a therapist?""","""Look for someone who is licensed, experienced, and with whom you feel comfortable talking.""",Therapy Guidance,Finding the right therapist.
"""Can mindfulness practices really help with my mental health?""","""Yes, mindfulness can reduce stress, increase awareness, and improve emotional regulation.""",Mindfulness,Benefits of mindfulness practices.
"""How can I support a friend who is going through a tough time?""","""Listen without judgment, offer help, and encourage them to seek professional support if needed.""",Friendship Support,Supporting friends in distress.
"""What are the long-term effects of untreated anxiety?""","""Untreated anxiety can lead to chronic stress, depression, and physical health problems.""",Mental Health Awareness,Understanding the consequences of untreated anxiety.
"""How can I manage my time better to reduce feelings of overwhelm?""","""Prioritize tasks, set realistic goals, and use tools like planners or apps to stay organized.""",Time Management,Improving time management skills.
"""What are some techniques for improving my sleep quality?""","""Establish a sleep routine, limit screen time before bed, and create a relaxing environment.""",Sleep Hygiene,Enhancing sleep quality.
"""How do I deal with criticism without it affecting my mental health?""","""Try to view criticism as feedback, focus on constructive aspects, and remind yourself of your strengths.""",Emotional Resilience,Handling criticism effectively.
"""What can I do if I feel stuck in a negative thought cycle?""","""Challenge negative thoughts with positive affirmations and practice mindfulness techniques.""",Cognitive Techniques,Breaking negative thought patterns.
"""How can I build resilience in the face of challenges?""","""Develop strong social connections, practice self-care, and maintain a positive outlook.""",Resilience Building,Cultivating resilience.
"""What role does diet play in mental health?""","""A balanced diet can improve mood and energy levels, while poor nutrition can contribute to mental health issues.""",Nutrition,Understanding the link between diet and mental health.
"""How do I know if I’m experiencing burnout?""","""Signs include exhaustion, detachment, and reduced performance or satisfaction in work.""",Burnout Awareness,Recognizing burnout symptoms.
"""What can I do to improve my self-esteem?""","""Challenge negative self-talk, celebrate small achievements, and surround yourself with supportive people.""",Self-Esteem,Building self-confidence.
"""How can I talk to my boss about my mental health needs?""","""Prepare your thoughts, be honest about your situation, and propose possible solutions.""",Workplace Communication,Addressing mental health at work.
"""What are some healthy coping mechanisms for stress?""","""Exercise, meditation, journaling, and talking to friends are effective coping strategies.""",Coping Strategies,Managing stress in healthy ways.
"""How can I find a support group for mental health?""","""Check local community centers, mental health organizations, or online platforms for groups.""",Community Resources,Finding peer support networks.
"""What should I do if I feel suicidal?""","""Seek immediate help by contacting a crisis hotline or going to the nearest emergency room.""",Crisis Intervention,Addressing suicidal thoughts.
"""How can I encourage my partner to seek help for their mental health?""","""Express your concerns compassionately and provide information on available resources.""",Relationship Support,Supporting a partner in seeking help.
"""What are some signs that my mental health is improving?""","""Improved mood, increased energy, and greater engagement in activities can indicate progress.""",Progress Tracking,Recognizing improvement in mental health.
"""How do I start a conversation about mental health with my friends?""","""Approach the topic gently, share your own experiences, and create a safe space for dialogue.""",Communication Skills,Initiating mental health discussions.
"""What is the difference between a psychologist and a psychiatrist?""","""Psychologists focus on therapy, while psychiatrists can prescribe medication.""",Mental Health Professions,Understanding mental health roles.
"""How can I practice gratitude to improve my mental well-being?""","""Keep a gratitude journal, reflect on positive experiences, and express appreciation to others.""",Gratitude Practices,Incorporating gratitude into daily life.
"""What should I do if I feel overwhelmed by social situations?""","""Practice deep breathing, prepare topics in advance, and consider taking breaks when needed.""",Social Anxiety,Coping with social situations.
"""How can I cope with the fear of rejection?""","""Challenge negative beliefs, focus on your strengths, and practice self-compassion.""",Fear Management,Overcoming fear of rejection.
"""What are the benefits of journaling for mental health?""","""Journaling can help process emotions, clarify thoughts, and track progress over time.""",Reflective Practices,Using journaling as a mental health tool.
"""How can I establish a self-care routine that works for me?""","""Identify activities that rejuvenate you, schedule them regularly, and prioritize self-care.""",Self-Care,Creating a personalized self-care plan.
"""What should I do if I feel isolated in my community?""","""Seek out local clubs or organizations, volunteer, or connect with online communities.""",Community Connection,Addressing feelings of isolation.
"""How can I handle anxiety before a big presentation?""","""Practice your presentation, visualize success, and use relaxation techniques beforehand.""",Performance Anxiety,Managing anxiety related to public speaking.
"""What are some strategies to help me stay motivated?""","""Set clear goals, break tasks into smaller steps, and reward yourself for progress.""",Motivation,Boosting motivation effectively.
"""How can social media affect my mental health?""","""It can increase feelings of inadequacy or anxiety but also provide support and connection.""",Social Media,Exploring social media's impact on mental health.
"""What can I do to help my children understand mental health?""","""Educate them about emotions, encourage open discussions, and model healthy coping strategies.""",Parenting,Teaching children about mental health.
"""How can I support my mental health during a major life change?""","""Lean on your support system, maintain routines, and practice self-care.""",Life Changes,Navigating major transitions.
"""What are some effective ways to deal with anger?""","""Take deep breaths, step away from the situation, and express your feelings constructively.""",Anger Management,Managing anger healthily.
"""How can I recognize the signs of a mental health crisis?""","""Signs can include extreme mood swings, withdrawal, or talk of self-harm.""",Crisis Awareness,Identifying mental health crises.
"""What should I do if I’m struggling to find motivation for daily tasks?""","""Break tasks into smaller steps and set achievable goals to regain momentum.""",Motivation,Overcoming lack of motivation.
"""How can I reduce my perfectionism to improve my mental health?""","""Set realistic expectations, celebrate small wins, and practice self-compassion.""",Perfectionism,Addressing perfectionistic tendencies.
"""What are some common misconceptions about mental health?""","""Many believe mental illness is a sign of weakness or that it can’t be treated effectively.""",Mental Health Literacy,Debunking myths about mental health.
"""How can I create a supportive environment at home?""","""Encourage open communication, provide resources, and foster a sense of belonging.""",Home Environment,Building a supportive home atmosphere.
"""What is cognitive-behavioral therapy, and how can it help me?""","""CBT helps identify and change negative thought patterns, improving emotional responses.""",Therapy Options,Understanding cognitive-behavioral therapy.
"""How do I know if I’m experiencing PTSD?""","""Symptoms include flashbacks, nightmares, and severe anxiety following a traumatic event.""",Trauma Awareness,Recognizing PTSD symptoms.
"""What are some signs that my medication needs to be adjusted?""","""Increased side effects, worsening symptoms, or no improvement could indicate a need for change.""",Medication Management,Monitoring medication effectiveness.
"""How can I practice mindfulness in my daily life?""","""Incorporate mindfulness exercises like meditation or mindful walking into your routine.""",Mindfulness,Applying mindfulness practices.
"""What should I do if I’m feeling overwhelmed by the news?""","""Limit your news consumption, focus on positive stories, and engage in self-care.""",Media Consumption,Managing news-related stress.
"""How can I set healthy boundaries with my friends and family?""","""Communicate your needs clearly and practice saying 'no' when necessary.""",Boundary Setting,Establishing healthy boundaries.
"""What resources are available for mental health during crises?""","""Hotlines, local mental health centers, and online chat services can provide immediate help.""",Crisis Resources,Finding immediate support options.
"""How can I deal with feelings of guilt or shame?""","""Talk to someone you trust, practice self-compassion, and challenge negative beliefs.""",Emotional Support,Addressing feelings of guilt and shame.
"""What are some relaxation techniques I can try at home?""","""Try progressive muscle relaxation, deep breathing exercises, or yoga.""",Relaxation Techniques,Exploring relaxation methods.
"""How can I help my partner when they’re feeling down?""","""Be present, listen actively, and encourage them to seek professional help if needed.""",Relationship Support,Supporting a partner in distress.
"""What are the effects of chronic stress on my body and mind?""","""Chronic stress can lead to anxiety, depression, and physical health issues like heart disease.""",Health Impact,Understanding stress effects on health.
"""How can I improve my emotional intelligence?""","""Practice self-awareness, empathy, and active listening in your interactions.""",Emotional Intelligence,Developing emotional awareness.
"""What should I do if I find it hard to talk about my feelings?""","""Start by journaling your thoughts and gradually share them with someone you trust.""",Communication Skills,Improving emotional expression.
