Input Prompt,Response,Category,Context
"""I'm feeling overwhelmed with work and life balance.""","""It’s important to prioritize self-care. Have you considered setting boundaries?""",Work Stress,Discussing work-life balance challenges.
"""I keep getting anxious before public speaking.""","""Practice can help! Try rehearsing in front of a mirror or with friends.""",Social Anxiety,Addressing anxiety in social situations.
"""How can I support my friend who is going through a tough time?""","""Just being there and listening can mean a lot. Sometimes, check-ins are enough.""",Peer Support,Supporting friends in mental health crises.
"""I’m struggling with motivation in my studies.""","""Have you thought about breaking your tasks into smaller, manageable goals?""",Academic Stress,Dealing with academic-related stress.
"""What should I do if I feel like I'm burning out?""","""Recognizing the signs of burnout is key. Consider taking a break or seeking help.""",Burnout,Identifying and addressing burnout in various sectors.
"""I'm feeling isolated in my new job.""","""Try reaching out to colleagues for casual chats. Building connections takes time.""",Workplace Isolation,Navigating new social dynamics at work.
"""How can I manage my emotions better?""","""Mindfulness and journaling are effective techniques. Have you tried either?""",Emotional Regulation,Techniques for emotional management.
"""I'm worried about my aging parents' mental health.""","""Engage them in conversations and encourage them to seek professional help if needed.""",Family Dynamics,Addressing mental health concerns in family.
"""What can I do when I feel overwhelmed by negative thoughts?""","""Challenging those thoughts and replacing them with positive affirmations can help.""",Cognitive Distress,Coping strategies for negative thinking.
"""Is it normal to feel sad sometimes without a reason?""","""Yes, it's completely normal. Emotions can be complex and don’t always have clear triggers.""",Emotional Awareness,Understanding emotional experiences.
"""I'm feeling pressure to succeed in my career.""","""Remember that success is subjective. Define what success means for you personally.""",Career Pressure,Navigating expectations in the professional realm.
"""How can I cope with grief after losing a loved one?""","""Allow yourself to grieve. Consider talking to a therapist or joining a support group.""",Grief Support,Managing grief and loss.
"""What strategies can help with work-related anxiety?""","""Deep breathing exercises and time management can be beneficial. Have you tried them?""",Anxiety Management,Coping mechanisms for work-related anxiety.
"""I feel guilty for taking a mental health day.""","""Taking care of your mental health is essential. It’s okay to prioritize your well-being.""",Self-Care,Understanding the importance of self-care.
"""How do I recognize when I need professional help?""","""If your feelings persist or interfere with daily life, it might be time to reach out.""",Mental Health Awareness,Recognizing the need for professional intervention.
"""I feel anxious about going to therapy.""","""It's normal to feel nervous. Remember, the therapist is there to help you.""",Therapy Anxiety,Pre-therapy concerns and expectations.
"""How do I help my child who seems anxious at school?""","""Talk to them about their feelings and consider involving a school counselor.""",Parenting Support,Supporting children's mental health in education.
"""What can I do to improve my sleep quality?""","""Establishing a bedtime routine and reducing screen time before bed can help.""",Sleep Health,Discussing sleep hygiene and mental health.
"""I'm feeling lonely even when I'm with others.""","""Try to engage in deeper conversations. Connection often requires vulnerability.""",Loneliness,Exploring feelings of loneliness in social settings.
"""How do I deal with negative feedback at work?""","""Try to view it as constructive criticism. Focus on what you can learn from it.""",Workplace Feedback,Managing professional criticism.
"""I'm having trouble focusing at work.""","""Consider using techniques like the Pomodoro Technique to enhance concentration.""",Focus Issues,Strategies for maintaining focus at work.
"""What should I do if I feel restless all the time?""","""Physical activity can help. Have you tried yoga or going for walks?""",Restlessness,Addressing feelings of restlessness.
"""How can I talk to my boss about my mental health?""","""Be honest but professional. Explain how it affects your work and discuss solutions.""",Workplace Wellness,Navigating mental health conversations at work.
"""Why do I feel anxious in social situations?""","""Social anxiety is common. Gradual exposure can help you become more comfortable.""",Social Anxiety,Understanding and managing social anxiety.
"""I often feel overwhelmed with parenting.""","""Don’t hesitate to ask for help. Connecting with other parents can provide support.""",Parenting Stress,Addressing parenting challenges and seeking support.
"""How do I cope with performance anxiety?""","""Visualization techniques and breathing exercises can be very effective.""",Performance Anxiety,Strategies for overcoming performance-related anxiety.
"""What should I do when I feel burnt out at work?""","""Taking a short break or using your vacation days can provide relief.""",Burnout,Recognizing and addressing workplace burnout.
"""How can I support someone with depression?""","""Listen without judgment and encourage them to seek professional help.""",Mental Health Support,Being a supportive friend to someone with depression.
"""I often feel like I'm not good enough.""","""Challenge those thoughts with evidence of your achievements and strengths.""",Self-Esteem,Addressing feelings of inadequacy.
"""What are some signs I should seek therapy?""","""If you’re feeling persistently sad or unable to cope, it’s a good idea to reach out.""",Therapy Awareness,Recognizing the need for professional help.
"""I was bullied in school, and it still affects me.""","""Talking to a therapist can help you process those experiences and heal.""",Childhood Trauma,Impact of childhood bullying on adulthood.
"""How can I cope with anxiety about job interviews?""","""Practice common questions and visualize a positive outcome.""",Job Anxiety,Preparing for job interviews.
"""I'm feeling burnt out in my tech job.""","""Consider taking a mental health day and setting clear boundaries.""",Burnout,Burnout in the IT sector.
"""What should I do if I feel overwhelmed by financial stress?""","""Create a budget and reach out to a financial advisor for guidance.""",Financial Stress,Addressing financial anxiety.
"""How can I improve my communication with my partner?""","""Practice active listening and express your feelings openly.""",Relationship Issues,Enhancing communication in personal relationships.
"""I feel like I'm constantly competing with my colleagues.""","""Focus on your own goals rather than comparing yourself to others.""",Workplace Competition,Navigating competitive work environments.
"""My parents are getting older, and I'm worried about them.""","""Encourage open conversations about their needs and consider professional support.""",Family Affairs,Concerns about aging parents' mental health.
"""What can I do to feel more confident in social situations?""","""Gradual exposure to social events can help build confidence over time.""",Social Anxiety,Building social confidence.
"""I'm struggling to manage my time as a student.""","""Use planners and prioritize tasks to create a more manageable schedule.""",Academic Pressure,Time management for students.
"""How do I know if I'm experiencing depression?""","""Look for persistent sadness, lack of interest in activities, or changes in sleep.""",Mental Health Awareness,Recognizing symptoms of depression.
"""I'm worried my job is affecting my mental health.""","""Consider discussing your feelings with a trusted colleague or HR.""",Workplace Wellness,Identifying work-related mental health issues.
"""How can I help my child cope with anxiety?""","""Teach them relaxation techniques and encourage open discussions about their feelings.""",Parenting Support,Supporting anxious children.
"""I'm feeling disconnected from my friends.""","""Initiate a conversation or plan a get-together to strengthen those bonds.""",Friendship Issues,Addressing feelings of isolation.
"""What strategies can help me deal with perfectionism?""","""Set realistic goals and practice self-compassion when you don’t meet them.""",Perfectionism,Managing perfectionistic tendencies.
"""I feel pressure to maintain a work-life balance.""","""Set boundaries and prioritize time for yourself and family.""",Work-Life Balance,Navigating work-life balance challenges.
"""How do I address childhood trauma in therapy?""","""It’s important to work with a therapist experienced in trauma-informed care.""",Therapy Techniques,Discussing childhood trauma in therapeutic settings.
"""What should I do if I feel overwhelmed by family expectations?""","""Communicate your feelings to your family and set healthy boundaries.""",Family Dynamics,Managing family pressures and expectations.
"""I struggle with decision-making due to anxiety.""","""Consider listing pros and cons to clarify your thoughts and reduce anxiety.""",Decision-Making Anxiety,Coping with anxiety in decision-making.
"""How can I cope with grief after losing a pet?""","""Allow yourself to grieve and seek support from friends or pet loss support groups.""",Grief Support,Managing grief from the loss of a pet.
"""How do I deal with the stress of standardized testing?""","""Practice relaxation techniques and ensure you’re well-prepared.""",Academic Pressure,Coping with exam-related stress.
"""I often feel anxious about financial decisions.""","""Consult a financial planner or seek advice from trusted friends.""",Financial Stress,Navigating financial anxieties.
"""How can I support a friend going through a breakup?""","""Listen without judgment and encourage them to express their feelings.""",Relationship Support,Supporting friends through tough times.
"""I feel isolated in my new city.""","""Join local groups or classes to meet new people and build connections.""",Loneliness,Navigating social isolation in a new environment.
"""What should I do if I feel overwhelmed by parenting?""","""Reach out to other parents for support and share your experiences.""",Parenting Stress,Addressing the challenges of parenting.
"""I'm worried about my child's performance in school.""","""Focus on encouraging effort rather than results, and communicate openly with teachers.""",Parenting Support,Supporting children's academic performance.
"""How can I cope with stress during exam season?""","""Create a study schedule, take breaks, and practice relaxation techniques.""",Academic Pressure,Managing stress during exams.
"""I often feel insecure in my relationships.""","""Communicate your feelings with your partner; open dialogue can build trust.""",Relationship Issues,Addressing insecurity in personal relationships.
"""What should I do if I feel detached from my emotions?""","""Consider journaling to explore your feelings and speaking with a therapist.""",Emotional Awareness,Understanding emotional detachment.
"""How can I talk to my boss about my workload?""","""Prepare specific examples of your workload and suggest solutions during the conversation.""",Workplace Wellness,Discussing workload concerns at work.
"""I feel guilty for wanting alone time.""","""Remember that self-care is important; it’s okay to prioritize your mental health.""",Self-Care,Navigating feelings of guilt related to self-care.
"""How can I improve my mental health during financial stress?""","""Create a budget and consider speaking with a financial advisor for support.""",Financial Stress,Coping with financial anxiety.
"""What should I do if I feel anxious about going out?""","""Start with small outings and gradually increase your comfort level.""",Social Anxiety,Overcoming anxiety about social situations.
"""I'm feeling overwhelmed by family responsibilities.""","""Don’t hesitate to delegate tasks and ask for help from family members.""",Family Dynamics,Managing family obligations and stress.
"""How can I support my partner who is feeling depressed?""","""Encourage them to talk about their feelings and suggest seeking professional help.""",Relationship Support,Supporting a partner with depression.
"""What techniques can help me manage my stress?""","""Try mindfulness meditation, exercise, or hobbies that you enjoy.""",Stress Management,Exploring stress relief techniques.
"""I find it hard to concentrate on my studies.""","""Minimize distractions and create a dedicated study space to improve focus.""",Academic Pressure,Enhancing concentration for studying.
"""How can I address feelings of inadequacy in my job?""","""Reflect on your accomplishments and seek feedback from trusted colleagues.""",Self-Esteem,Building self-esteem in the workplace.
"""I'm feeling burnt out in my teaching job.""","""Consider taking a mental health day and reflecting on your work-life balance.""",Burnout,Managing burnout in education.
"""How can I help my elderly parent maintain independence?""","""Encourage them to participate in community activities and maintain social connections.""",Aging Parents,Supporting independence in aging parents.
"""What should I do if I feel overwhelmed by social media?""","""Take regular breaks from social media and focus on in-person interactions.""",Digital Wellness,Coping with social media overload.
"""How can I communicate better with my co-workers?""","""Practice active listening and give constructive feedback during discussions.""",Workplace Communication,Improving communication skills at work.
"""I feel anxious about starting therapy.""","""It’s completely normal to feel that way; therapists are there to support you.""",Therapy Anxiety,Overcoming anxiety about starting therapy.
"""How can I deal with peer pressure in my social circle?""","""Stay true to your values and practice saying no confidently.""",Peer Pressure,Navigating peer influence.
"""What can I do if I feel unmotivated to work?""","""Set small, achievable goals to help spark motivation and track your progress.""",Motivation Issues,Coping with lack of motivation at work.
"""I'm struggling with my self-image.""","""Consider talking to a therapist about your feelings and practice self-compassion.""",Body Image,Addressing body image issues.
"""How can I help my friend who's dealing with a breakup?""","""Be there to listen and support them without judgment; validate their feelings.""",Friendship Support,Supporting friends through emotional challenges.
"""How do I handle conflicts with co-workers?""","""Address conflicts directly but calmly; focus on finding a solution rather than blaming.""",Conflict Resolution,Managing workplace conflicts.
"""I feel lost in my career and don't know what to do.""","""Consider exploring new interests or talking to a career coach for guidance.""",Career Guidance,Seeking direction in career paths.
"""How can I support my sibling with addiction?""","""Encourage them to seek professional help and be there to listen without judgment.""",Addiction Support,Supporting family members with addiction issues.
"""I'm feeling pressure to conform to social norms.""","""Focus on being your authentic self; surround yourself with supportive people.""",Social Pressure,Navigating societal expectations.
"""What can I do to enhance my emotional intelligence?""","""Practice self-reflection and actively seek feedback from others about your interactions.""",Emotional Intelligence,Developing emotional awareness and skills.
"""How can I manage anxiety before a presentation?""","""Practice your presentation multiple times and visualize a successful outcome.""",Performance Anxiety,Coping with anxiety related to public speaking.
"""I'm struggling with balancing my studies and personal life.""","""Create a schedule that prioritizes both study time and personal activities.""",Academic Pressure,Managing time as a student.
"""What can I do if I feel overwhelmed with family responsibilities?""","""Don’t hesitate to delegate tasks to other family members and communicate openly.""",Family Dynamics,Addressing feelings of overwhelm at home.
"""How do I support my partner dealing with anxiety?""","""Listen actively and encourage them to express their feelings; suggest professional help if needed.""",Relationship Support,Supporting a partner's mental health.
"""What should I do if I feel constantly tired and unmotivated?""","""Evaluate your sleep habits and consider incorporating regular exercise into your routine.""",Fatigue,Addressing lack of motivation and energy.
"""I feel like I'm not achieving my goals.""","""Reassess your goals to ensure they are realistic and break them down into smaller steps.""",Self-Esteem,Managing feelings of inadequacy.
"""How can I cope with my fear of failure?""","""Reframe your mindset; view failure as a learning opportunity rather than a setback.""",Fear of Failure,Addressing fears related to success.
"""What can I do to improve my self-confidence?""","""Engage in positive self-talk and set achievable goals to build your confidence gradually.""",Confidence,Building self-esteem and self-worth.
"""I'm feeling isolated at work.""","""Try to connect with colleagues during breaks or join a workplace group or club.""",Workplace Isolation,Navigating feelings of isolation in the workplace.
"""How can I help my child who struggles with anxiety?""","""Teach them coping strategies like deep breathing and encourage open conversations.""",Parenting Support,Supporting anxious children.
"""What are some effective ways to practice mindfulness?""","""Incorporate meditation, deep breathing, or mindful walking into your daily routine.""",Mindfulness,Techniques for practicing mindfulness.
"""How can I approach my boss about mental health concerns?""","""Be honest about your feelings, and suggest potential solutions or accommodations.""",Workplace Wellness,Discussing mental health in the workplace.
"""I'm struggling with body image issues.""","""Focus on your strengths and seek support from friends or professionals who can help.""",Body Image,Addressing body image concerns.
"""What should I do if I'm feeling overwhelmed by my finances?""","""Create a budget and prioritize your expenses; consider talking to a financial advisor.""",Financial Stress,Managing financial anxiety.
"""How can I better manage my stress?""","""Identify stressors and develop coping strategies like exercise, hobbies, or meditation.""",Stress Management,Exploring stress relief techniques.
"""I find it hard to say no to others.""","""Practice assertiveness and understand that it's okay to prioritize your own needs.""",Assertiveness,Developing assertiveness skills.
"""What can I do if I feel lost after graduation?""","""Explore different career options, volunteer, or consider further education to find direction.""",Career Guidance,Navigating post-graduation uncertainty.
"""How do I deal with grief after losing a loved one?""","""Allow yourself to grieve and consider joining a support group for shared experiences.""",Grief Support,Coping with loss and grief.
"""I'm feeling pressure to conform to societal expectations.""","""Focus on what truly makes you happy and surround yourself with supportive people.""",Social Pressure,Navigating societal norms.
"""How can I help a friend who is struggling with addiction?""","""Encourage them to seek professional help and be supportive without enabling their behavior.""",Addiction Support,Supporting friends with addiction issues.
"""What strategies can help with sleep issues?""","""Establish a bedtime routine, limit screen time before bed, and create a calming environment.""",Sleep Health,Improving sleep hygiene and quality.
"""How can I cope with feelings of inadequacy at work?""","""Seek feedback from trusted colleagues and focus on your accomplishments.""",Workplace Confidence,Addressing feelings of inadequacy at work.
"""I'm feeling anxious about my future.""","""Focus on the present and take actionable steps toward your goals; seek guidance if needed.""",Future Anxiety,Managing anxiety about future uncertainties.
"""How can I improve my emotional regulation?""","""Practice mindfulness and journaling to understand your emotions better.""",Emotional Intelligence,Enhancing emotional awareness and regulation.
"""I feel guilty for taking time for myself.""","""Remind yourself that self-care is essential for overall well-being; it’s not selfish.""",Self-Care,Navigating guilt associated with self-care.
"""What should I do if I feel overwhelmed by negative thoughts?""","""Challenge those thoughts with evidence and practice positive affirmations.""",Cognitive Distress,Managing negative thinking patterns.
"""How can I better communicate with my family?""","""Set aside time for family discussions and practice active listening.""",Family Communication,Enhancing communication in family settings.
"""I'm struggling to maintain friendships.""","""Make an effort to reach out and plan regular catch-ups to strengthen connections.""",Friendship Issues,Navigating challenges in maintaining friendships.
"""What can I do to deal with feelings of loneliness?""","""Join clubs or community groups to meet new people and engage in social activities.""",Loneliness,Addressing feelings of isolation.
"""How can I cope with stress during a life transition?""","""Stay organized, reach out for support, and take time to adapt to changes.""",Life Transitions,Managing stress during significant life changes.
"""I'm feeling overwhelmed by technology use.""","""Set boundaries for screen time and prioritize in-person interactions.""",Digital Wellness,Navigating the impact of technology on mental health.
"""How can I support a colleague experiencing burnout?""","""Encourage them to take breaks and consider speaking with HR for support.""",Workplace Support,Supporting colleagues facing burnout.
"""What should I do if I'm feeling stressed at home?""","""Create a calming space, establish boundaries, and practice relaxation techniques.""",Home Stress,Managing stress within the home environment.
"""How can I help my teen cope with peer pressure?""","""Encourage open conversations about their feelings and reinforce their self-esteem.""",Parenting Teens,Supporting teenagers in dealing with peer pressure.
"""I often feel anxious in crowded places.""","""Practice deep breathing exercises and gradually expose yourself to those situations.""",Social Anxiety,Coping with anxiety in social settings.
"""What strategies can help with work-life balance?""","""Set clear boundaries between work and personal time, and prioritize self-care.""",Work-Life Balance,Navigating the challenges of work-life balance.
"""I feel overwhelmed by my responsibilities as a caregiver.""","""Seek support from local groups and take breaks to recharge.""",Caregiver Stress,Managing caregiver responsibilities and stress.
"""How can I cope with feelings of anger?""","""Practice relaxation techniques and consider talking to someone about your feelings.""",Anger Management,Addressing and managing feelings of anger.
"""What can I do to build resilience?""","""Focus on developing coping strategies and maintaining a strong support network.""",Resilience,Enhancing personal resilience in tough times.
"""I'm feeling anxious about returning to work after a break.""","""Prepare by gradually reintroducing yourself to work tasks and maintaining a positive mindset.""",Workplace Anxiety,Transitioning back to work after a break.
"""How can I deal with conflicts in my relationships?""","""Communicate openly, listen actively, and seek compromise.""",Relationship Conflicts,Managing interpersonal conflicts effectively.
"""I struggle with procrastination.""","""Break tasks into smaller, manageable parts and set deadlines for each.""",Procrastination,Overcoming procrastination habits.
"""What should I do if I feel like I can't cope?""","""Reach out for support from friends, family, or a mental health professional.""",Mental Health Support,Seeking help when feeling overwhelmed.
"""How can I support my mental health during a pandemic?""","""Stay connected with loved ones, maintain a routine, and focus on self-care.""",Pandemic Stress,Coping with mental health during challenging times.
"""I feel pressure to succeed academically.""","""Remember that everyone has their own path; focus on your personal goals.""",Academic Pressure,Managing academic success pressures.
"""What strategies can help me express my emotions better?""","""Consider journaling, art, or talking with trusted friends about your feelings.""",Emotional Expression,Enhancing emotional communication skills.
"""How can I build better habits for my mental health?""","""Start small, set achievable goals, and track your progress regularly.""",Habit Formation,Developing healthy mental health habits.
"""I'm worried about making the wrong life choices.""","""Remember that it's okay to seek advice and that most choices can be adjusted over time.""",Decision-Making Anxiety,Coping with decision-making fears.
"""How can I handle stress from working remotely?""","""Establish a dedicated workspace and take regular breaks to maintain boundaries.""",Remote Work Stress,Managing stress while working from home.
"""What can I do if I'm feeling jealous of others?""","""Reflect on your own achievements and focus on gratitude for what you have.""",Jealousy,Addressing feelings of jealousy.
"""How can I find motivation during a tough time?""","""Set small, manageable goals and celebrate your progress to build momentum.""",Motivation Issues,Seeking motivation in challenging situations.
