Input Prompt,Response,Category,Context
"""What should I do if I'm feeling anxious about the future?""","""Focus on what you can control, practice mindfulness, and seek support from friends or professionals.""",Future Anxiety,Managing anxiety related to the future.
"""How can I foster healthy relationships with my children?""","""Communicate openly, show empathy, and engage in shared activities.""",Parenting Support,Building strong parent-child relationships.
"""What can I do to improve my overall happiness?""","""Engage in activities that bring joy, practice gratitude, and nurture relationships.""",Happiness Improvement,Enhancing overall happiness.
"""How can I navigate feelings of jealousy in my relationships?""","""Communicate openly with your partner, practice self-reflection, and focus on gratitude.""",Jealousy Management,Addressing jealousy in relationships.
"""What should I do if I feel stuck in my life?""","""Reflect on your goals, seek support, and consider new experiences or perspectives.""",Personal Growth,Moving forward when feeling stuck.
"""How can I practice compassion towards myself?""","""Acknowledge your struggles, treat yourself with kindness, and engage in self-care.""",Self-Compassion,Cultivating compassion for oneself.
"""What are some effective strategies for managing grief?""","""Allow yourself to grieve, seek support, and engage in activities that honor your loss.""",Grief Management,Coping with grief and loss.
"""How can I support a loved one experiencing depression?""","""Be present, listen without judgment, and encourage them to seek professional help.""",Depression Support,Supporting someone with depression.
"""What should I do if I'm feeling stuck in a negative thought cycle?""","""Challenge negative thoughts, practice mindfulness, and seek support if needed.""",Cognitive Restructuring,Breaking free from negative thought patterns.
"""How can I improve my emotional intelligence?""","""Practice self-awareness, empathize with others, and develop strong communication skills.""",Emotional Intelligence,Enhancing emotional awareness and understanding.
"""What are some strategies for coping with the pressures of parenthood?""","""Set realistic expectations, prioritize self-care, and seek support from your partner.""",Parenting Support,Managing the challenges of being a parent.
"""How can I cultivate a sense of purpose in my life?""","""Reflect on your values, set meaningful goals, and engage in activities that align with them.""",Purpose Exploration,Discovering personal purpose.
"""What should I do if I'm feeling overwhelmed by societal issues?""","""Acknowledge your feelings, engage in discussions, and consider taking action in your community.""",Societal Awareness,Coping with societal stressors.
"""How can I manage feelings of burnout in my work?""","""Set boundaries, practice self-care, and seek support from colleagues.""",Burnout Management,Addressing burnout in the workplace.
"""What can I do to promote mental wellness in my community?""","""Organize events, create support groups, and share resources for mental health awareness.""",Community Engagement,Advocating for mental wellness in your community.
"""How can I deal with feelings of inadequacy in my relationships?""","""Reflect on your self-worth, communicate with your partner, and seek professional help if needed.""",Relationship Health,Addressing feelings of inadequacy in relationships.
"""What are some effective coping strategies for managing anxiety?""","""Practice deep breathing, engage in physical activity, and seek professional support if needed.""",Anxiety Management,Effectively managing anxiety symptoms.
"""How can I navigate feelings of inadequacy in my career?""","""Focus on your achievements, seek mentorship, and set realistic goals for growth.""",Career Confidence,Overcoming feelings of inadequacy in the workplace.
"""What should I do if I feel overwhelmed by personal expectations?""","""Reassess your goals, communicate your needs, and seek support from friends.""",Expectation Management,Managing personal expectations.
"""How can I build healthy coping mechanisms for my emotional well-being?""","""Identify triggers, practice self-care, and seek support from others.""",Coping Skills,Developing healthy coping strategies.
"""What are some techniques for improving emotional regulation?""","""Practice mindfulness, recognize triggers, and develop a toolbox of coping strategies.""",Emotional Regulation,Enhancing skills for managing emotions.
"""How can I support my mental health during a career change?""","""Seek support, focus on self-care, and set realistic expectations during the transition.""",Career Transition,Navigating career changes while maintaining well-being.
"""What should I do if I'm feeling anxious about public speaking?""","""Prepare thoroughly, practice relaxation techniques, and seek feedback from trusted peers.""",Public Speaking Anxiety,Managing anxiety around public speaking.
"""How can I improve my assertiveness in professional settings?""","""Practice clear communication, set boundaries, and seek feedback on your interactions.""",Assertiveness Training,Enhancing assertiveness at work.
"""What are some signs that I might be experiencing a mental health issue?""","""Persistent sadness, anxiety, changes in sleep, and difficulty functioning are red flags.""",Self-Assessment,Identifying mental health concerns.
"""How can I improve my communication skills with my family?""","""Practice active listening, express your feelings, and be open to feedback.""",Family Communication,Enhancing communication within the family.
"""What can I do to build my emotional resilience?""","""Engage in self-care, maintain supportive relationships, and practice problem-solving.""",Resilience Building,Developing emotional resilience skills.
"""How can I navigate feelings of loneliness in a new environment?""","""Seek out social opportunities, connect with others, and engage in community activities.""",Loneliness Management,Managing loneliness in new situations.
"""What should I do if I'm feeling anxious about a big decision?""","""Weigh pros and cons, seek advice, and give yourself permission to take time for reflection.""",Decision-Making Anxiety,Managing anxiety related to decision-making.
"""How can I enhance my self-awareness for personal growth?""","""Reflect regularly, seek feedback, and engage in activities that challenge you.""",Self-Awareness,Developing self-awareness for growth.
"""What are some strategies for effective teamwork?""","""Communicate openly, establish clear roles, and foster a supportive environment.""",Team Collaboration,Enhancing teamwork and collaboration skills.
"""How can I support my mental health while pursuing my studies?""","""Balance study time with breaks, practice self-care, and reach out for support when needed.""",Academic Support,Maintaining mental health during studies.
"""What should I do if I'm feeling overwhelmed by my emotions?""","""Practice grounding techniques, reach out for support, and consider mindfulness exercises.""",Emotional Regulation,Managing overwhelming emotions effectively.
"""How can I cultivate a supportive network around me?""","""Engage in community activities, maintain relationships, and seek out supportive spaces.""",Social Connection,Building a supportive community network.
"""What can I do to improve my work-life balance?""","""Set boundaries, prioritize self-care, and communicate your needs to others.""",Work-Life Balance,Enhancing balance between work and personal life.
"""How can I deal with feelings of inadequacy in my friendships?""","""Reflect on your worth, communicate openly, and focus on gratitude.""",Friendship Health,Managing feelings of inadequacy in friendships.
"""What should I do if I'm feeling stuck in my personal growth?""","""Reassess your goals, seek support, and engage in activities that inspire you.""",Personal Development,Moving forward when feeling stagnant.
"""How can I practice mindfulness during stressful times?""","""Focus on your breath, observe your surroundings, and practice self-compassion.""",Mindfulness,Cultivating mindfulness in challenging situations.
"""What are some effective ways to cope with work-related stress?""","""Set boundaries, take breaks, and seek support from colleagues.""",Work Stress Management,Managing stress in the workplace effectively.
"""How can I maintain a positive outlook during difficult times?""","""Practice gratitude, seek support, and focus on small, positive actions.""",Positive Outlook,Nurturing positivity during challenges.
"""What should I do if I feel overwhelmed by personal expectations?""","""Reassess your goals, communicate your needs, and seek support from friends.""",Expectation Management,Managing personal expectations effectively.
"""How can I cope with feelings of regret?""","""Acknowledge your feelings, practice self-compassion, and focus on personal growth.""",Regret Management,Navigating feelings of regret and guilt.
"""Why do I feel so sad all the time?""","""It's okay to feel sad sometimes; it can be caused by many things. Talking about it can help.""",Emotional Awareness,Understanding feelings of sadness.
"""What should I do if I'm really worried about school?""","""Try talking to a trusted adult or friend, and practice deep breathing to calm your mind.""",Anxiety Management,Coping with school-related anxiety.
"""How can I stop feeling lonely?""","""Reach out to friends, join clubs, or try activities you enjoy to meet new people.""",Social Connection,Dealing with loneliness.
"""Why do I feel angry all the time?""","""Feeling angry is normal, but it’s important to find safe ways to express it, like talking or drawing.""",Anger Management,Managing feelings of anger.
"""What can I do if I have bad dreams?""","""Talk about your dreams with someone, and try relaxing activities before bed.""",Sleep Hygiene,Addressing nightmares and sleep issues.
"""How can I handle my feelings when my parents argue?""","""It's tough to see parents argue; talk to someone you trust about your feelings.""",Family Dynamics,Coping with family conflicts.
"""Why do I feel nervous around other kids?""","""Many people feel nervous in social situations. Practice talking to friends or try to focus on fun activities.""",Social Anxiety,Managing social interactions.
"""How can I feel better when I'm upset?""","""Try talking about your feelings, drawing, or engaging in a favorite hobby.""",Emotional Regulation,Finding comfort during distress.
"""What should I do if I'm scared of things at night?""","""You can create a calming bedtime routine and talk about your fears with a parent or guardian.""",Fear Management,Addressing nighttime fears.
"""How can I deal with pressure to do well in school?""","""Remember, it's okay to ask for help. Break tasks into smaller steps and take breaks.""",Academic Pressure,Coping with school expectations.
"""What if I feel different from everyone else?""","""It's okay to feel different. Everyone has unique qualities; try to embrace what makes you special.""",Identity Exploration,Understanding uniqueness.
"""How can I talk to someone about my feelings?""","""You can start by saying how you feel and asking them to listen without judgment.""",Communication Skills,Improving communication about feelings.
"""What should I do if I feel really scared or anxious?""","""Try some deep breathing, talk to someone you trust, and remember that it’s okay to ask for help.""",Anxiety Management,Addressing feelings of fear and anxiety.
"""Why do I have trouble focusing in class?""","""Distractions are normal; try finding a quiet space to study and take breaks to recharge.""",Focus and Attention,Improving concentration in learning environments.
"""How can I feel safe when I’m anxious?""","""Create a comfort box with things that make you feel secure, like a favorite toy or book.""",Safety and Security,Finding safety in moments of anxiety.
"""What can I do if I feel like I don’t belong?""","""Talk to someone about your feelings and look for activities where you can meet others with similar interests.""",Belonging,Addressing feelings of isolation.
"""How can I understand my feelings better?""","""Keep a feelings journal where you write about your emotions and what triggers them.""",Self-Reflection,Enhancing emotional awareness.
"""What do I do if I think I need help?""","""It's brave to ask for help. Talk to a parent, teacher, or school counselor about how you feel.""",Seeking Support,Recognizing the need for assistance.
"""How can I cope with changes in my life?""","""Talk about your feelings with someone you trust and try to keep some routines to feel secure.""",Coping with Change,Managing life transitions.
"""What if I feel pressure to be perfect?""","""Remember that nobody is perfect; it’s okay to make mistakes and learn from them.""",Perfectionism,Navigating expectations of perfection.
"""How can I be kinder to myself when I mess up?""","""Treat yourself like you would a friend—be understanding and patient.""",Self-Compassion,Fostering self-kindness.
"""What should I do if I feel overwhelmed with everything?""","""Take a break, focus on one thing at a time, and talk to someone about how you feel.""",Stress Management,Managing overwhelming feelings.
"""How can I support a friend who seems sad?""","""Be there for them, listen without judging, and encourage them to talk about their feelings.""",Friendship Support,Helping friends in distress.
"""Why do I feel confused about my emotions?""","""It's normal to feel mixed emotions; talking through them can help clarify how you feel.""",Emotional Clarity,Understanding complex feelings.
"""What can I do if I feel like I don’t fit in at school?""","""Try joining clubs or activities that interest you; it’s a great way to meet people with similar interests.""",Social Connection,Building connections in school.
"""How can I express my feelings without getting angry?""","""Practice using 'I' statements to express how you feel, like 'I feel upset when...'""",Anger Management,Healthy expression of emotions.
"""What should I do if I feel like nobody understands me?""","""Talk to someone you trust about how you feel; sometimes, just sharing helps.""",Feeling Understood,Seeking empathy and understanding.
"""How can I learn to relax when I'm stressed?""","""Try deep breathing exercises, listening to music, or engaging in a hobby you love.""",Relaxation Techniques,Finding ways to manage stress.
"""What can I do if I'm scared of talking to adults?""","""Practice what you want to say, and remember that adults are there to help you.""",Communication Skills,Overcoming fears in communication.
"""How can I build my confidence?""","""Set small goals and celebrate your successes, no matter how tiny.""",Confidence Building,Fostering self-esteem and confidence.
"""What if I feel too much pressure to make friends?""","""Building friendships takes time; focus on being yourself and meeting people gradually.""",Social Skills,Managing social pressures.
"""How can I cope with feelings of guilt?""","""Acknowledge your feelings, talk about them, and remind yourself that everyone makes mistakes.""",Guilt Management,Addressing feelings of guilt.
"""What should I do if I feel like crying all the time?""","""It’s okay to cry; it can be a way to express your feelings. Talk to someone who can help.""",Emotional Expression,Coping with frequent sadness.
"""How can I help myself when I'm feeling lost?""","""Reflect on what you enjoy, talk to someone you trust, and set small goals to find direction.""",Self-Discovery,Finding direction and purpose.
"""What can I do to feel less anxious about tests?""","""Prepare by studying in chunks, practice relaxation techniques, and remind yourself it’s okay to do your best.""",Test Anxiety,Managing anxiety around assessments.
"""How can I stay positive when things are tough?""","""Focus on small positives, talk to supportive friends, and remember that tough times pass.""",Positive Thinking,Cultivating positivity during challenges.
"""What should I do if I feel overwhelmed by my emotions?""","""Practice grounding techniques, reach out for support, and consider mindfulness exercises.""",Emotional Regulation,Managing overwhelming emotions effectively.
"""How can I build a routine that makes me feel better?""","""Start small; include activities you enjoy, set a consistent bedtime, and prioritize self-care.""",Routine Building,Establishing healthy daily routines.
"""What can I do if I feel stressed about my friends?""","""Communicate openly with them about how you feel and make time for self-care.""",Friendship Management,Addressing friendship-related stress.
"""How can I support my mental health while dealing with bullying?""","""Talk to someone you trust about what’s happening and practice self-care to protect your well-being.""",Bullying Support,Coping with bullying situations.
"""What should I do if I feel like I'm not good enough?""","""Remind yourself of your strengths and talk to someone about these feelings.""",Self-Worth,Addressing feelings of inadequacy.
"""How can I express my feelings without hurting others?""","""Use 'I' statements and communicate openly about your emotions while being considerate.""",Healthy Communication,Expressing feelings constructively.
"""What if I feel anxious about making mistakes?""","""Remember that mistakes are part of learning; try to view them as opportunities for growth.""",Perfectionism,Managing fears of failure.
"""How can I find things to be grateful for?""","""Try keeping a gratitude journal where you write down a few things you appreciate each day.""",Gratitude Practice,Cultivating a positive outlook.
"""What do I do if I feel like I'm not being heard?""","""Share your feelings with someone you trust and ask them to listen actively.""",Communication Skills,Seeking validation and understanding.
"""How can I manage my time better?""","""Make a daily schedule that includes time for homework, relaxation, and fun activities.""",Time Management,Balancing responsibilities and leisure.
"""What if I feel overwhelmed with family responsibilities?""","""Talk to your family about how you feel and work together to share tasks.""",Family Dynamics,Addressing family pressures.
"""How can I cope with changes at school?""","""Share your feelings with friends, and try to keep some familiar routines to feel secure.""",Coping with Change,Navigating transitions in education.
"""What should I do if I'm feeling really down?""","""Talk to a trusted adult or friend, and consider engaging in activities you enjoy.""",Emotional Support,Seeking help during tough times.
"""How can I practice self-care?""","""Include activities you enjoy in your routine, like reading, drawing, or playing outside.""",Self-Care,Prioritizing personal well-being.
"""What can I do if I'm feeling left out?""","""Talk to your friends about how you feel, and try to invite them to do things together.""",Social Connection,Building social connections.
"""How can I help a friend who is being bullied?""","""Encourage them to talk to an adult and offer your support by being there for them.""",Friendship Support,Supporting friends in need.
"""What should I do if I can't stop thinking about something?""","""Practice mindfulness techniques to help redirect your thoughts and focus on the present.""",Thought Management,Managing intrusive thoughts.
"""How can I feel more confident in social situations?""","""Practice conversations with a friend or in front of a mirror to build comfort.""",Social Skills,Enhancing confidence in interactions.
"""What if I feel stressed about future plans?""","""Focus on what you can control, break things into smaller steps, and talk to someone for support.""",Future Anxiety,Coping with uncertainty about the future.
"""How can I talk to someone about my mental health?""","""Start by expressing that you want to share something important, and let them know how you feel.""",Seeking Support,Opening up about mental health struggles.
"""What can I do if I feel disconnected from my friends?""","""Reach out to them, suggest activities you can do together, and share how you're feeling.""",Social Connection,Strengthening friendships.
"""How can I find ways to relax after a tough day?""","""Try deep breathing, listening to music, or spending time in nature to unwind.""",Relaxation Techniques,Finding effective relaxation methods.
"""What should I do if I feel guilty about something?""","""Talk to someone about your feelings and consider what you can learn from the situation.""",Guilt Management,Processing feelings of guilt.
"""How can I express my feelings when I'm upset?""","""Use journaling, art, or talking to someone you trust to express how you feel.""",Emotional Expression,Finding ways to communicate emotions.
"""What can I do if I feel overwhelmed by homework?""","""Break it into smaller tasks, set a timer for focused study, and take breaks when needed.""",Academic Pressure,Managing homework-related stress.
"""How can I make new friends?""","""Join clubs or activities that interest you, and be open to starting conversations.""",Social Skills,Building new friendships.
"""What if I feel like I don't know who I am?""","""Explore your interests, talk to trusted friends, and allow yourself to grow and change.""",Identity Exploration,Discovering personal identity.
"""How can I cope with the loss of a pet?""","""Talk about your feelings with someone, and create a memory book to honor your pet.""",Grief Support,Processing loss and grief.
"""What should I do if I'm feeling anxious before a performance?""","""Practice relaxation techniques and visualize yourself doing well during the performance.""",Performance Anxiety,Managing anxiety in performance situations.
"""How can I find balance between school and fun?""","""Schedule time for both studying and leisure, and stick to your plan.""",Time Management,Balancing responsibilities and leisure activities.
"""What if I feel like I'm a burden to my friends?""","""Talk to them about your feelings; true friends will want to support you.""",Self-Worth,Addressing feelings of being a burden.
"""How can I build resilience when things get tough?""","""Focus on problem-solving, maintain a positive outlook, and reach out for support when needed.""",Resilience Building,Strengthening coping skills.
"""What can I do if I'm feeling anxious about social events?""","""Prepare yourself mentally, and bring a friend along for support.""",Social Anxiety,Managing social situations.
"""How can I cope with sibling rivalry?""","""Talk openly about your feelings with your siblings, and try to find common interests.""",Family Dynamics,Navigating sibling relationships.
"""What should I do if I feel too much pressure to fit in?""","""Remember, it's okay to be yourself; true friends will appreciate you for who you are.""",Peer Pressure,Managing the desire to fit in.
"""How can I express my feelings when I'm feeling down?""","""Use art, writing, or talking to a friend to share how you feel.""",Emotional Expression,Finding ways to communicate emotions.
"""What can I do if I'm feeling overwhelmed by changes at home?""","""Share your feelings with family members, and seek to understand each other's perspectives.""",Coping with Change,Navigating family transitions.
"""How can I find ways to be more positive?""","""Practice gratitude, focus on small victories, and surround yourself with supportive people.""",Positive Thinking,Cultivating a positive mindset.
"""What should I do if I feel like my friends are changing?""","""Communicate your feelings and try to adapt to the changes while seeking common interests.""",Friendship Dynamics,Managing evolving friendships.
"""How can I handle feeling left out in a group?""","""Talk to someone in the group about how you feel, and suggest activities to include everyone.""",Social Connection,Addressing feelings of exclusion.
"""What can I do if I'm feeling pressured to conform?""","""Stay true to yourself and surround yourself with people who accept you for who you are.""",Peer Pressure,Managing the pressure to fit in.
"""How can I communicate better with my family?""","""Share your thoughts openly and practice active listening to understand each other.""",Communication Skills,Improving family dynamics.
"""What if I feel anxious about new experiences?""","""Start by trying small new things and gradually work your way up to bigger experiences.""",Fear of the Unknown,Facing anxiety about change.
"""How can I cope with feelings of jealousy?""","""Acknowledge your feelings, reflect on what triggers them, and focus on your strengths.""",Jealousy Management,Navigating feelings of jealousy.
"""What should I do if I feel pressure to act a certain way?""","""Remember that it's okay to be yourself and not conform to others' expectations.""",Identity and Authenticity,Fostering personal authenticity.
"""How can I deal with my fears in a healthy way?""","""Identify your fears, talk about them, and try exposure exercises to gradually face them.""",Fear Management,Addressing and overcoming fears.
"""What can I do if I feel overwhelmed by negative thoughts?""","""Challenge negative thoughts with positive affirmations and talk to someone you trust.""",Thought Management,Managing negative thinking patterns.
"""How can I improve my mood when I'm feeling down?""","""Engage in activities you enjoy, connect with friends, or try physical exercise.""",Mood Enhancement,Boosting mood during tough times.
"""What should I do if I feel ashamed of my feelings?""","""It’s okay to feel what you feel; talk to someone who can help you process those emotions.""",Emotional Acceptance,Addressing feelings of shame.
