Input Prompt,Response,Category,Context
"""How can I communicate my feelings to my family?""","""Be open and honest about your emotions; encourage a two-way conversation.""",Family Communication,Strengthening family relationships.
"""What can I do if I'm feeling anxious about aging?""","""Focus on the positives of aging, set achievable goals, and engage in activities you enjoy.""",Aging Anxiety,Managing anxiety related to getting older.
"""How can I deal with feelings of grief after losing a loved one?""","""Allow yourself to grieve, seek support from friends or support groups, and remember it's okay to feel sad.""",Grief Support,Coping with loss in later life.
"""What should I do if I'm feeling a lack of motivation?""","""Set small, achievable goals, engage in activities you enjoy, and reach out for support.""",Motivation Issues,Overcoming lack of motivation.
"""How can I improve my social connections?""","""Join clubs, attend local events, or take classes to meet new people with similar interests.""",Social Engagement,Building a supportive social network.
"""What if I feel like my mental health is declining?""","""Seek help from a mental health professional; be open about your feelings and experiences.""",Mental Health Awareness,Recognizing and addressing declines in mental health.
"""How can I manage anxiety related to financial concerns?""","""Create a budget, seek financial advice, and talk to someone about your worries.""",Financial Stress,Navigating financial anxiety in later life.
"""What should I do if I'm feeling disconnected from my partner?""","""Engage in open conversations and plan activities that bring you closer together.""",Relationship Dynamics,Addressing emotional distance in relationships.
"""How can I handle feelings of regret about my past?""","""Reflect on your experiences, focus on lessons learned, and consider setting new goals.""",Regret Management,Processing past regrets and moving forward.
"""What can I do if I'm struggling with chronic pain and mental health?""","""Seek a multidisciplinary approach to treatment and consider therapy to manage the emotional impact.""",Pain Management,Addressing the interplay of physical and mental health.
"""How can I stay engaged in life during challenging times?""","""Focus on daily routines, seek support, and engage in activities that bring you joy.""",Life Engagement,Maintaining involvement in life.
"""What should I do if I feel pressure from my family to be 'successful'?""","""Communicate your feelings and remind them of your personal goals and values.""",Familial Pressure,Navigating expectations from family.
"""How can I improve my emotional resilience?""","""Practice self-compassion, maintain a support network, and view challenges as opportunities.""",Resilience Building,Strengthening coping mechanisms.
"""What can I do if I'm feeling stuck in my career?""","""Consider exploring new opportunities, updating your skills, or seeking a career coach.""",Career Transition,Managing dissatisfaction with career.
"""How can I cope with feelings of envy toward others?""","""Reflect on your feelings, practice gratitude, and focus on your own achievements.""",Envy Management,Addressing feelings of comparison.
"""What should I do if I'm experiencing feelings of abandonment?""","""Talk about your feelings with trusted friends or family; consider therapy to explore these emotions.""",Abandonment Issues,Processing feelings of loss or rejection.
"""How can I support a friend who's struggling with mental health?""","""Listen actively, validate their feelings, and encourage them to seek professional help if necessary.""",Peer Support,Being there for others in need.
"""What can I do if I'm feeling overwhelmed by societal changes?""","""Focus on what you can control, engage in community discussions, and seek support from like-minded individuals.""",Societal Pressure,Coping with changes in society.
"""How can I improve my coping strategies for stress?""","""Explore relaxation techniques, engage in physical activities, and develop a support network.""",Stress Management,Finding effective ways to cope with stress.
"""What should I do if I'm feeling fearful about the future?""","""Focus on setting realistic goals, practice mindfulness, and seek support from loved ones.""",Future Anxiety,Managing uncertainty about the future.
"""How can I maintain my mental health during caregiving?""","""Prioritize self-care, seek respite care, and connect with other caregivers for support.""",Caregiver Support,Balancing caregiving with self-care.
"""What can I do if I'm struggling with feelings of worthlessness?""","""Reflect on your strengths, seek support, and consider talking to a therapist about your feelings.""",Self-Worth,Building a positive self-image.
"""How can I enhance my sense of purpose in life?""","""Engage in activities that resonate with your values, volunteer, or explore new interests.""",Purposeful Living,Finding meaning in life.
"""What should I do if I'm feeling pressured to stay active?""","""Listen to your body, set realistic goals, and focus on activities you enjoy rather than what others expect.""",Activity Pressure,Managing expectations around physical activity.
"""How can I communicate my mental health struggles to my employer?""","""Be honest about your feelings, discuss possible accommodations, and focus on solutions.""",Workplace Communication,Addressing mental health in the workplace.
"""What can I do if I'm feeling disconnected from my hobbies?""","""Explore new interests, revisit old passions, and allow yourself to try different activities.""",Hobbies and Interests,Rekindling interest in personal passions.
"""How can I improve my mindfulness practice?""","""Start with short sessions, focus on your breath, and gradually increase the duration as you feel comfortable.""",Mindfulness Practice,Enhancing mental well-being through mindfulness.
"""What should I do if I'm feeling overwhelmed by responsibilities?""","""Prioritize tasks, set realistic boundaries, and seek support from family or friends.""",Time Management,Managing daily responsibilities.
"""How can I cope with feelings of inadequacy as I age?""","""Recognize that everyone has unique journeys; focus on your achievements and practice self-compassion.""",Aging Self-Worth,Addressing feelings of inadequacy in later life.
"""What can I do if I'm feeling burdened by my past experiences?""","""Consider talking to a therapist to process your feelings and work toward healing.""",Past Trauma,Addressing unresolved emotional issues.
"""How can I find a support group for my age group?""","""Look for local community centers or online platforms that cater to your demographic.""",Support Systems,Seeking community support.
"""What should I do if I'm feeling isolated from my peers?""","""Reach out to friends, engage in local activities, or consider joining clubs or groups.""",Peer Connection,Building connections with others.
"""How can I manage my emotional responses to stress?""","""Practice relaxation techniques, identify triggers, and develop coping strategies.""",Emotional Regulation,Enhancing emotional control.
"""What can I do if I'm feeling stuck in my daily routine?""","""Experiment with new activities, change your environment, and allow yourself to break the routine.""",Routine Discomfort,Exploring new experiences in daily life.
"""How can I enhance my understanding of mental health?""","""Educate yourself through reputable resources, attend workshops, or connect with mental health professionals.""",Mental Health Education,Increasing awareness and knowledge about mental health.
"""What should I do if I'm feeling exhausted from caregiving?""","""Seek respite care, communicate your needs to family, and engage in self-care activities.""",Caregiver Fatigue,Managing the demands of caregiving.
"""How can I deal with feelings of nostalgia that make me sad?""","""Reflect on the good memories, but also focus on the present and create new experiences.""",Nostalgia Management,Balancing fond memories with current life.
"""What can I do if I'm feeling like I’ve lost my passion for life?""","""Explore new interests, set small goals, and engage in activities that once brought you joy.""",Passion Exploration,Reigniting enthusiasm for life.
"""How can I cope with feelings of anxiety when facing changes?""","""Practice deep breathing, visualize positive outcomes, and take one step at a time.""",Change Anxiety,Managing anxiety around transitions.
"""What should I do if I'm feeling unsupported by my family?""","""Communicate your needs clearly; consider family counseling if necessary.""",Family Support,Enhancing family dynamics.
"""How can I navigate friendships that feel one-sided?""","""Reflect on your expectations and communicate your feelings to your friend.""",Friendship Dynamics,Managing imbalance in relationships.
"""What can I do if I’m feeling unappreciated at work?""","""Communicate your contributions, seek feedback, and consider discussing your feelings with a supervisor.""",Workplace Satisfaction,Addressing feelings of being undervalued.
"""How can I create a more positive mindset?""","""Practice gratitude, focus on your strengths, and surround yourself with supportive people.""",Positive Thinking,Cultivating a healthier outlook on life.
"""What should I do if I’m feeling like my life lacks direction?""","""Explore your interests, set goals, and seek guidance from mentors or coaches.""",Life Direction,Finding purpose and direction in life.
"""How can I manage feelings of inadequacy compared to my peers?""","""Recognize that everyone’s journey is different; focus on your personal growth and achievements.""",Peer Comparison,Addressing feelings of inadequacy.
"""What can I do if I'm feeling overwhelmed by technology?""","""Take breaks from screens, simplify your technology use, and focus on in-person interactions.""",Technology Overload,Managing tech-related stress.
"""How can I establish a better work-life balance?""","""Set clear boundaries, prioritize tasks, and make time for personal activities.""",Work-Life Balance,Enhancing quality of life through balance.
"""What should I do if I feel pressure to conform to societal norms?""","""Reflect on your values, embrace your individuality, and connect with like-minded individuals.""",Societal Expectations,Navigating external pressures.
"""How can I find joy in the small things in life?""","""Practice mindfulness, express gratitude, and take time to appreciate everyday moments.""",Joyful Living,Cultivating happiness in daily life.
"""What can I do if I'm feeling burdened by unfulfilled dreams?""","""Reflect on what you truly want, and consider setting new, achievable goals.""",Unfulfilled Aspirations,Addressing feelings of missed opportunities.
"""How can I support my partner's mental health?""","""Listen actively, encourage open communication, and suggest seeking professional help if needed.""",Relationship Support,Being a supportive partner.
"""How can I cope with feelings of loneliness as I age?""","""Engage in community activities, reconnect with old friends, and consider volunteering.""",Loneliness,Managing social connections in later life.
"""What should I do if I'm feeling overwhelmed by health concerns?""","""Talk to your doctor about your worries, and consider mindfulness practices to manage anxiety.""",Health Anxiety,Navigating health-related stress.
"""How can I improve my sleep quality?""","""Establish a calming bedtime routine, limit screen time before bed, and create a comfortable sleep environment.""",Sleep Hygiene,Addressing sleep difficulties in middle age.
"""What if I'm feeling restless and unfulfilled in retirement?""","""Explore new hobbies, consider part-time work, or engage in community projects to find purpose.""",Retirement Adjustment,Finding meaning post-retirement.
"""How can I manage feelings of depression?""","""Reach out to a mental health professional, engage in physical activity, and maintain a routine.""",Depression Management,Seeking help for depressive symptoms.
"""What should I do if I'm struggling with my identity as I age?""","""Reflect on your values, explore new interests, and seek support from friends or a therapist.""",Identity Exploration,Navigating identity changes in later life.
"""How can I communicate my feelings to my family?""","""Be open and honest about your emotions; encourage a two-way conversation.""",Family Communication,Strengthening family relationships.
"""What can I do if I'm feeling anxious about aging?""","""Focus on the positives of aging, set achievable goals, and engage in activities you enjoy.""",Aging Anxiety,Managing anxiety related to getting older.
"""How can I deal with feelings of grief after losing a loved one?""","""Allow yourself to grieve, seek support from friends or support groups, and remember it's okay to feel sad.""",Grief Support,Coping with loss in later life.
"""What should I do if I'm feeling a lack of motivation?""","""Set small, achievable goals, engage in activities you enjoy, and reach out for support.""",Motivation Issues,Overcoming lack of motivation.
"""How can I improve my social connections?""","""Join clubs, attend local events, or take classes to meet new people with similar interests.""",Social Engagement,Building a supportive social network.
"""What if I feel like my mental health is declining?""","""Seek help from a mental health professional; be open about your feelings and experiences.""",Mental Health Awareness,Recognizing and addressing declines in mental health.
"""How can I manage anxiety related to financial concerns?""","""Create a budget, seek financial advice, and talk to someone about your worries.""",Financial Stress,Navigating financial anxiety in later life.
"""What should I do if I'm feeling disconnected from my partner?""","""Engage in open conversations and plan activities that bring you closer together.""",Relationship Dynamics,Addressing emotional distance in relationships.
"""How can I handle feelings of regret about my past?""","""Reflect on your experiences, focus on lessons learned, and consider setting new goals.""",Regret Management,Processing past regrets and moving forward.
"""What can I do if I'm struggling with chronic pain and mental health?""","""Seek a multidisciplinary approach to treatment and consider therapy to manage the emotional impact.""",Pain Management,Addressing the interplay of physical and mental health.
"""How can I stay engaged in life during challenging times?""","""Focus on daily routines, seek support, and engage in activities that bring you joy.""",Life Engagement,Maintaining involvement in life.
"""What should I do if I feel pressure from my family to be 'successful'?""","""Communicate your feelings and remind them of your personal goals and values.""",Familial Pressure,Navigating expectations from family.
"""How can I improve my emotional resilience?""","""Practice self-compassion, maintain a support network, and view challenges as opportunities.""",Resilience Building,Strengthening coping mechanisms.
"""What can I do if I'm feeling stuck in my career?""","""Consider exploring new opportunities, updating your skills, or seeking a career coach.""",Career Transition,Managing dissatisfaction with career.
"""How can I cope with feelings of envy toward others?""","""Reflect on your feelings, practice gratitude, and focus on your own achievements.""",Envy Management,Addressing feelings of comparison.
"""What should I do if I'm experiencing feelings of abandonment?""","""Talk about your feelings with trusted friends or family; consider therapy to explore these emotions.""",Abandonment Issues,Processing feelings of loss or rejection.
"""How can I support a friend who's struggling with mental health?""","""Listen actively, validate their feelings, and encourage them to seek professional help if necessary.""",Peer Support,Being there for others in need.
"""What can I do if I'm feeling overwhelmed by societal changes?""","""Focus on what you can control, engage in community discussions, and seek support from like-minded individuals.""",Societal Pressure,Coping with changes in society.
"""How can I improve my coping strategies for stress?""","""Explore relaxation techniques, engage in physical activities, and develop a support network.""",Stress Management,Finding effective ways to cope with stress.
"""What should I do if I'm feeling fearful about the future?""","""Focus on setting realistic goals, practice mindfulness, and seek support from loved ones.""",Future Anxiety,Managing uncertainty about the future.
"""How can I maintain my mental health during caregiving?""","""Prioritize self-care, seek respite care, and connect with other caregivers for support.""",Caregiver Support,Balancing caregiving with self-care.
"""What can I do if I'm struggling with feelings of worthlessness?""","""Reflect on your strengths, seek support, and consider talking to a therapist about your feelings.""",Self-Worth,Building a positive self-image.
"""How can I enhance my sense of purpose in life?""","""Engage in activities that resonate with your values, volunteer, or explore new interests.""",Purposeful Living,Finding meaning in life.
"""What should I do if I'm feeling pressured to stay active?""","""Listen to your body, set realistic goals, and focus on activities you enjoy rather than what others expect.""",Activity Pressure,Managing expectations around physical activity.
"""How can I communicate my mental health struggles to my employer?""","""Be honest about your feelings, discuss possible accommodations, and focus on solutions.""",Workplace Communication,Addressing mental health in the workplace.
"""What can I do if I'm feeling disconnected from my hobbies?""","""Explore new interests, revisit old passions, and allow yourself to try different activities.""",Hobbies and Interests,Rekindling interest in personal passions.
"""How can I improve my mindfulness practice?""","""Start with short sessions, focus on your breath, and gradually increase the duration as you feel comfortable.""",Mindfulness Practice,Enhancing mental well-being through mindfulness.
"""What should I do if I'm feeling overwhelmed by responsibilities?""","""Prioritize tasks, set realistic boundaries, and seek support from family or friends.""",Time Management,Managing daily responsibilities.
"""How can I cope with feelings of inadequacy as I age?""","""Recognize that everyone has unique journeys; focus on your achievements and practice self-compassion.""",Aging Self-Worth,Addressing feelings of inadequacy in later life.
"""What can I do if I'm feeling burdened by my past experiences?""","""Consider talking to a therapist to process your feelings and work toward healing.""",Past Trauma,Addressing unresolved emotional issues.
"""How can I find a support group for my age group?""","""Look for local community centers or online platforms that cater to your demographic.""",Support Systems,Seeking community support.
"""What should I do if I'm feeling isolated from my peers?""","""Reach out to friends, engage in local activities, or consider joining clubs or groups.""",Peer Connection,Building connections with others.
"""How can I manage my emotional responses to stress?""","""Practice relaxation techniques, identify triggers, and develop coping strategies.""",Emotional Regulation,Enhancing emotional control.
"""What can I do if I'm feeling stuck in my daily routine?""","""Experiment with new activities, change your environment, and allow yourself to break the routine.""",Routine Discomfort,Exploring new experiences in daily life.
"""How can I enhance my understanding of mental health?""","""Educate yourself through reputable resources, attend workshops, or connect with mental health professionals.""",Mental Health Education,Increasing awareness and knowledge about mental health.
"""What should I do if I'm feeling exhausted from caregiving?""","""Seek respite care, communicate your needs to family, and engage in self-care activities.""",Caregiver Fatigue,Managing the demands of caregiving.
"""How can I effectively manage my time to reduce stress?""","""Create a schedule, prioritize tasks, and allow for breaks to recharge.""",Time Management,Enhancing time management skills.
"""How can I cope with stress from financial instability?""","""Seek support from local charities, practice stress management techniques, and focus on small, achievable goals.""",Financial Stress,Managing anxiety related to money issues.
"""What should I do if I'm feeling hopeless about my situation?""","""Reach out to support groups, engage in community resources, and try to focus on small positive changes.""",Hopelessness,Finding support in difficult circumstances.
"""How can I access mental health services when I can't afford it?""","""Look for community health centers that offer sliding scale fees or free services.""",Access to Care,Seeking affordable mental health resources.
"""What can I do to improve my self-esteem when I feel worthless?""","""Focus on your strengths, celebrate small achievements, and seek supportive relationships.""",Self-Esteem,Building confidence despite financial challenges.
"""How can I manage anxiety when I face daily struggles?""","""Practice mindfulness, engage in physical activity, and connect with community support.""",Anxiety Management,Coping with stressors related to poverty.
"""What should I do if I feel isolated in my community?""","""Look for local support groups, community centers, or volunteering opportunities to meet new people.""",Social Isolation,Building connections in challenging environments.
"""How can I deal with feelings of shame about my financial situation?""","""Remember that your worth isn't defined by your circumstances; consider talking to someone who can relate.""",Shame,Addressing stigma related to poverty.
"""What can I do if I'm overwhelmed by my responsibilities?""","""Prioritize tasks, seek help from friends or community programs, and allow yourself breaks.""",Overwhelm,Managing daily life under stress.
"""How can I cope with feelings of despair?""","""Reach out to supportive friends or family, consider journaling your feelings, and seek professional help if possible.""",Despair,Finding ways to uplift your mental state.
"""What should I do if I'm feeling trapped in my current situation?""","""Focus on setting small goals, seek out job training programs, and connect with local resources.""",Feeling Trapped,Finding pathways to improve circumstances.
"""How can I find hope for a better future?""","""Engage in community programs, set small, achievable goals, and seek inspiration from others’ stories.""",Hopefulness,Cultivating optimism in difficult times.
"""What can I do if I'm struggling with depression?""","""Look for free or low-cost mental health services, engage in physical activity, and reach out to trusted friends.""",Depression,Seeking help for depressive symptoms.
"""How can I better manage my emotions?""","""Practice deep breathing, engage in hobbies, and connect with supportive individuals.""",Emotional Regulation,Improving emotional health under stress.
"""What should I do if I'm feeling constantly tired and unmotivated?""","""Ensure you're getting enough rest, try to engage in light exercise, and set small daily goals.""",Fatigue,Coping with low energy levels.
"""How can I find resources for mental health support in my area?""","""Search online for local mental health organizations or visit community centers for information.""",Resource Access,Finding local mental health resources.
"""What can I do if I'm facing discrimination due to my financial status?""","""Connect with advocacy groups and seek support from individuals who understand your situation.""",Discrimination,Addressing social stigma and bias.
"""How can I help my children cope with the stress of living in poverty?""","""Talk openly about feelings, engage in positive activities, and seek community support.""",Parenting Under Stress,Supporting children's mental health in tough situations.
"""What should I do if I feel like I have no control over my life?""","""Focus on what you can control, such as daily routines and small personal goals.""",Lack of Control,Regaining a sense of agency in life.
"""How can I build resilience despite financial struggles?""","""Develop a support network, practice self-care, and celebrate small wins.""",Resilience,Strengthening coping mechanisms.
"""What can I do to reduce anxiety related to finding a job?""","""Prepare by updating your resume, practice interview skills, and seek support from job programs.""",Job Search Anxiety,Managing stress in employment situations.
"""How can I create a sense of stability for my family?""","""Establish daily routines, communicate openly, and engage in community support programs.""",Family Stability,Building a stable environment under stress.
"""What should I do if I'm feeling angry about my circumstances?""","""Channel your anger into constructive actions, like advocating for change or engaging in community service.""",Anger Management,Processing feelings related to injustice.
"""How can I deal with feelings of despair during difficult times?""","""Reach out for support, focus on small, achievable goals, and consider talking to a mental health professional.""",Despair,Coping with overwhelming situations.
"""What can I do if I'm feeling anxious about upcoming bills?""","""Create a budget, reach out to local assistance programs, and talk to someone about your worries.""",Financial Anxiety,Managing financial stress.
"""How can I find joy in my life despite financial hardships?""","""Engage in free or low-cost activities, focus on positive relationships, and practice gratitude.""",Joyfulness,Cultivating happiness amid challenges.
